{"booking":null,"offer":{"alternatives":[{"choices":[{"end_utc":1799341200,"field_id":"field:elm","price_minor":2100,"session_id":"session:7","start_utc":1799335800,"venue_ref":"venue:synthetic"}],"session_id":"session:7"},{"choices":[],"session_id":"session:8"},{"choices":[{"end_utc":1799494200,"field_id":"field:elm","price_minor":2100,"session_id":"session:9","start_utc":1799488800,"venue_ref":"venue:synthetic"}],"session_id":"session:9"}],"currency":"EUR","fields":[{"field_id":"field:elm","full_size":true,"price_minor":2100,"surface":"natural_grass"}],"offer_revision":4,"request":{"budget_minor":7000,"currency":"EUR","operation":"FIND_OFFER","owner_approval_ref":null,"request_id":"request:exam:one","revision":1,"sessions":[{"allow_shift_minutes":0,"end":"2027-01-07T18:00:00","session_id":"session:7","start":"2027-01-07T16:30:00"},{"allow_shift_minutes":0,"end":"2027-01-08T12:30:00","session_id":"session:8","start":"2027-01-08T11:00:00"},{"allow_shift_minutes":0,"end":"2027-01-09T12:30:00","session_id":"session:9","start":"2027-01-09T11:00:00"}],"team_ref":"team:one","timezone":"Europe/Tirane","venue_ref":"venue:synthetic"},"schedule_revision":4,"slots":[],"status":"NO_COMPLETE_OFFER","total_minor":0},"publisher":"VenueRoot","recipient":"ActivePlanetRoot","request_sha256":"785cf3b0568f2b365786ebc2a66928d86af0be286a6980d3fca4322de67ac02f","source_lineage_refs":["work_results:245b8a020d02409d2be9b35d8d526feb7cadc305940ec2d2a16b563bb743a57e"],"source_record_ref":"018926ddc598863691c594891b540bbd2f484e3a4f1d705f636d4324e1c9372d","source_review_ref":"af8791b7a82705f0f34479d48523a2e829c43e740c0708b39e90d41c233a25c6","source_revision":4,"source_work_ref":"work_results:245b8a020d02409d2be9b35d8d526feb7cadc305940ec2d2a16b563bb743a57e","time_envelope":{"ct_context_anchor":1790359281,"et_observed_at":1790359281,"freshness_policy_id":"freshness:football:source","kt_as_of":1790359281,"pt_created_at":1790359281,"source_observed_at":1790359281,"source_reported_at":1790359281,"system_ingested_at":1790359281,"system_verified_at":1790359281,"time_envelope_id":"drstime_v01:f27ee471346bd64e4f037da53e49edecae52cd6ab415be57d8cd4ea3300eb6b3","time_envelope_version":"v0.1","ttl_seconds":300,"valid_from":1790359281,"valid_to":1790359581},"ttl_base":"pt_created_at","version":"g51.body.v01"}